key,0,1
#,,
int32,str,str
0,"TEXT_AKTKMA111_04367_SEQ_00","七贤人庭园的阿莉塞神色黯然。"
1,"TEXT_AKTKMA111_04367_SEQ_01",""
2,"TEXT_AKTKMA111_04367_SEQ_02",""
3,"TEXT_AKTKMA111_04367_SEQ_03",""
4,"TEXT_AKTKMA111_04367_SEQ_04",""
5,"TEXT_AKTKMA111_04367_SEQ_05",""
6,"TEXT_AKTKMA111_04367_SEQ_06",""
7,"TEXT_AKTKMA111_04367_SEQ_07",""
8,"TEXT_AKTKMA111_04367_SEQ_08",""
9,"TEXT_AKTKMA111_04367_SEQ_09",""
10,"TEXT_AKTKMA111_04367_SEQ_10",""
11,"TEXT_AKTKMA111_04367_SEQ_11",""
12,"TEXT_AKTKMA111_04367_SEQ_12",""
13,"TEXT_AKTKMA111_04367_SEQ_13",""
14,"TEXT_AKTKMA111_04367_SEQ_14",""
15,"TEXT_AKTKMA111_04367_SEQ_15",""
16,"TEXT_AKTKMA111_04367_SEQ_16",""
17,"TEXT_AKTKMA111_04367_SEQ_17",""
18,"TEXT_AKTKMA111_04367_SEQ_18",""
19,"TEXT_AKTKMA111_04367_SEQ_19",""
20,"TEXT_AKTKMA111_04367_SEQ_20",""
21,"TEXT_AKTKMA111_04367_SEQ_21",""
22,"TEXT_AKTKMA111_04367_SEQ_22",""
23,"TEXT_AKTKMA111_04367_SEQ_23",""
24,"TEXT_AKTKMA111_04367_TODO_00","和阿尔菲诺对话进入同行状态"
25,"TEXT_AKTKMA111_04367_TODO_01","带着阿尔菲诺和阿莉塞对话进入同行状态"
26,"TEXT_AKTKMA111_04367_TODO_02","带着阿尔菲诺与阿莉塞
和阿梅莉安丝对话"
27,"TEXT_AKTKMA111_04367_TODO_03","和阿尔菲诺对话"
28,"TEXT_AKTKMA111_04367_TODO_04","和正厅的可露儿对话"
29,"TEXT_AKTKMA111_04367_TODO_05",""
30,"TEXT_AKTKMA111_04367_TODO_06",""
31,"TEXT_AKTKMA111_04367_TODO_07",""
32,"TEXT_AKTKMA111_04367_TODO_08",""
33,"TEXT_AKTKMA111_04367_TODO_09",""
34,"TEXT_AKTKMA111_04367_TODO_10",""
35,"TEXT_AKTKMA111_04367_TODO_11",""
36,"TEXT_AKTKMA111_04367_TODO_12",""
37,"TEXT_AKTKMA111_04367_TODO_13",""
38,"TEXT_AKTKMA111_04367_TODO_14",""
39,"TEXT_AKTKMA111_04367_TODO_15",""
40,"TEXT_AKTKMA111_04367_TODO_16",""
41,"TEXT_AKTKMA111_04367_TODO_17",""
42,"TEXT_AKTKMA111_04367_TODO_18",""
43,"TEXT_AKTKMA111_04367_TODO_19",""
44,"TEXT_AKTKMA111_04367_TODO_20",""
45,"TEXT_AKTKMA111_04367_TODO_21",""
46,"TEXT_AKTKMA111_04367_TODO_22",""
47,"TEXT_AKTKMA111_04367_TODO_23",""
48,"TEXT_AKTKMA111_04367_ALPHINAUD_000_000","父亲说得没错，我确实仍在暗中摸索。
可我想让他知道我绝不会驻足不前……
因为我已经向阿雷恩瓦尔德起誓了。"
49,"TEXT_AKTKMA111_04367_YSHTOLA_000_005","关于今后的行动，大家要慎重商议。"
50,"TEXT_AKTKMA111_04367_GRAHATIA_000_010","抱歉，让你也担心了。
直到解读政要记录之前都还没事呢，
就怪我在想事情的时候走出了禁书库。"
51,"TEXT_AKTKMA111_04367_GRAHATIA_000_011","当时精神全集中在思考上，
没注意到埋伏的警备用魔法人偶。
下一次……我会多加小心……"
52,"TEXT_AKTKMA111_04367_KRILE_000_015","也许你之后会被人指指点点，
但如有需要，尽管报上巴尔德西昂委员会的名号吧。"
53,"TEXT_AKTKMA111_04367_KRILE_000_016","我相信着勇于对抗威胁的拂晓血盟，
并且我也坚信如果是爷爷的话，
肯定会伸出援手的……"
54,"TEXT_AKTKMA111_04367_ALISAIE_000_020","虽然我们掌握的情报越来越清晰，
但还是希望哲学家议会亲自说明一下
他们所谓的使命是什么。"
55,"TEXT_AKTKMA111_04367_ALISAIE_000_021","他们要是没有干什么见不得人的事情，
那应该说出来也无妨啊。"
56,"TEXT_AKTKMA111_04367_ALISAIE_000_022","哪怕星球面临毁灭也要坚持完成的事情……
难道比我们和母亲的性命还要重要吗？"
57,"TEXT_AKTKMA111_04367_AMELIANCE_000_023","(-？？？？-)阿尔菲诺？阿莉塞？
太好了，看到你们没事我就放心了！"
58,"TEXT_AKTKMA111_04367_AMELIANCE_000_024","(-？？？？-)听说你们被带去接受审问了，
吓得我直接从家里跑了出来。
你们没事真是太好了……"
59,"TEXT_AKTKMA111_04367_ALISAIE_000_025","母亲？！"
60,"TEXT_AKTKMA111_04367_AMELIANCE_000_026","初次见面，
我是阿梅莉安丝·莱韦耶勒尔。"
61,"TEXT_AKTKMA111_04367_AMELIANCE_000_027","各位是拂晓血盟的人吧？
我的孩子们平日里承蒙你们照顾……
能见到你们真是我的荣幸！"
62,"TEXT_AKTKMA111_04367_ALPHINAUD_000_028","母亲，请别这样。
毕竟我们被逐出了家门……
要是别人看到我们在交谈，会给您添麻烦的。"
63,"TEXT_AKTKMA111_04367_AMELIANCE_000_029","哎呀，母亲和孩子叙旧有什么见不得人的！
听说你们和父亲在闹矛盾，
我只想尽早见到你们！"
64,"TEXT_AKTKMA111_04367_AMELIANCE_000_030","你们之后会跟我一起回一趟家吧？
我有礼物要交给你们。"
65,"TEXT_AKTKMA111_04367_YSHTOLA_000_031","那正好，我们需要结合桑克瑞德他们的报告
探讨今后该如何展开行动。"
66,"TEXT_AKTKMA111_04367_YSHTOLA_000_032","那我们先回巴尔德西昂分馆了，
你们就回家里看看吧。"
67,"TEXT_AKTKMA111_04367_ALISAIE_000_033","可、可是……
<Highlight>ObjectParameter(1)</Highlight>，你呢？"
68,"TEXT_AKTKMA111_04367_AMELIANCE_000_034","<Highlight>ObjectParameter(1)</Highlight>！
你就是<Highlight>ObjectParameter(1)</Highlight>呀？！"
69,"TEXT_AKTKMA111_04367_AMELIANCE_000_035","很高兴能见到你，今天真是幸运的一天！
请你也务必来我家坐坐。"
70,"TEXT_AKTKMA111_04367_AMELIANCE_000_036","既然决定了，就赶紧回去吧。
要是我家那位回来了，他拿我倒是没办法，
但佣人们可能会左右为难。"
71,"TEXT_AKTKMA111_04367_AMELIANCE_000_037","<Highlight>ObjectParameter(1)</Highlight>，请陪同我的孩子们回家哦！"
72,"TEXT_AKTKMA111_04367_ALISAIE_000_038","母亲真是的……"
73,"TEXT_AKTKMA111_04367_KRILE_000_039","那我们之后在巴尔德西昂分馆见吧。
你们三个回去慢慢聊！"
74,"TEXT_AKTKMA111_04367_ALISAIE_000_040","阿尔菲诺以前没少邀请同学来家里做客，
所以你去我家对他来说没什么特别的。
可我不一样……我有很多顾虑！很多很多！"
75,"TEXT_AKTKMA111_04367_ALPHINAUD_000_050","抱歉，把你卷进了我们的家事里……
不过看到母亲精神的样子，我感觉……总算是松了一口气。"
76,"TEXT_AKTKMA111_04367_ALPHINAUD_000_051","机会难得，虽然没有什么值得夸耀的，
但能请你和我们一起回趟家吗？"
77,"TEXT_AKTKMA111_04367_Q1_000_060","要做什么？"
78,"TEXT_AKTKMA111_04367_A1_000_061","对话"
79,"TEXT_AKTKMA111_04367_A1_000_062","解除同行状态"
80,"TEXT_AKTKMA111_04367_A1_000_063","取消"
81,"TEXT_AKTKMA111_04367_ALPHINAUD_000_065","带上阿莉塞一起回家吧。"
82,"TEXT_AKTKMA111_04367_Q2_000_070","确定要解除同行状态吗？"
83,"TEXT_AKTKMA111_04367_ALPHINAUD_000_071","你是有别的事情要做吗？
但毕竟已经和母亲约好了，我们会在哲学家广场等你。"
84,"TEXT_AKTKMA111_04367_ALPHINAUD_000_075","啊，不好意思，让你又来找我们一趟。
那接着朝我家走吧。"
85,"TEXT_AKTKMA111_04367_SYSTEM_000_080","同行者还没过来。
迎接并带他们来到附近，一起打听消息吧。"
86,"TEXT_AKTKMA111_04367_ALISAIE_000_088","别只带着我回去啊！
先去叫上阿尔菲诺再说！"
87,"TEXT_AKTKMA111_04367_SYSTEM_000_089","在执行该任务时，需要与阿尔菲诺保持同行状态。
此外，阿尔菲诺应位于玩家附近。"
88,"TEXT_AKTKMA111_04367_ALISAIE_000_090","呜呜呜……既然这样的话那就速去速回！
先跟你说清楚了，最多只能让你进到客厅……
可别想着偷看我的房间哦！绝对不行！"
89,"TEXT_AKTKMA111_04367_ALPHINAUD_000_091","这是为什么？
我记得你的房间一直很整洁啊……"
90,"TEXT_AKTKMA111_04367_ALISAIE_000_092","不是这种问题啦！
不管是谁……都会有那种不舍得丢弃的……
从小就喜欢的玩偶……什么的吧……"
91,"TEXT_AKTKMA111_04367_ALISAIE_000_093","啊——别管那么多了！
快点走吧，我们家就在那个阶梯的下面不远处！"
92,"TEXT_AKTKMA111_04367_SYSTEM_000_094","接下来将和阿尔菲诺以及阿莉塞同行。
在执行任务时，需要同行者处于附近位置。"
93,"TEXT_AKTKMA111_04367_SYSTEM_000_095","在同行状态下，切换区域或选择“解除同行状态”，
都将会解除同行的状态。"
94,"TEXT_AKTKMA111_04367_SYSTEM_000_096","同行状态解除后，
只要和回到了起点的同行者对话，就能再次进入同行状态。"
95,"TEXT_AKTKMA111_04367_A3_000_100","<UIForeground>F20224</UIForeground>关于桥上的风景<UIForeground>01</UIForeground>"
96,"TEXT_AKTKMA111_04367_A3_000_101","<UIForeground>F20224</UIForeground>关于海鹦广场<UIForeground>01</UIForeground>"
97,"TEXT_AKTKMA111_04367_ALPHINAUD_000_105","和你一起走在故乡的街道上还真是感觉有些不可思议呢。
不禁想跟你聊聊这里以前发生过的事情。"
98,"TEXT_AKTKMA111_04367_ALPHINAUD_000_106","要回到我家的话，也得带上阿莉塞呀。
到哲学家广场迎接她吧。"
99,"TEXT_AKTKMA111_04367_ALISAIE_000_110","我们家就在漂流的终点北边。
从哲学家广场顺着阶梯一直向下走不远就是了。"
100,"TEXT_AKTKMA111_04367_ALISAIE_000_111","先跟你打好招呼，可别太惊讶哦！"
101,"TEXT_AKTKMA111_04367_ALISAIE_000_112","阿尔菲诺应该在哲学家广场呢吧。
母亲也在等着我们回去，快点去叫上他吧。"
102,"TEXT_AKTKMA111_04367_ALPHINAUD_000_115","我和阿莉塞小时候
能够自由活动的范围也就到这座桥为止。"
103,"TEXT_AKTKMA111_04367_ALPHINAUD_000_116","虽说是自由活动……
不过当时也有母亲和佣人们跟着，
并不是只有我们两个。"
104,"TEXT_AKTKMA111_04367_ALPHINAUD_000_117","而如今不仅是大海的对面，连镜像世界我们都去过了。
这说明我也有所成长吧。"
105,"TEXT_AKTKMA111_04367_ALISAIE_000_120","小时候，我经常和阿尔菲诺一起
来这里等待父亲做完工作回来呢。"
106,"TEXT_AKTKMA111_04367_ALISAIE_000_121","有一回，可能是会议延长了吧，
左等右等父亲还是不回来……
我无聊地将身体探出了栏杆，眺望着小河。"
107,"TEXT_AKTKMA111_04367_ALISAIE_000_122","就在那时，刚巧回来的父亲大喊着“阿莉塞！”冲了过来。
真是令人怀念啊。"
108,"TEXT_AKTKMA111_04367_ALPHINAUD_000_125","啊，对了。
我人生中第一次对人使用魔法的地方就是这座广场。"
109,"TEXT_AKTKMA111_04367_ALPHINAUD_000_126","那时候阿莉塞狠狠地摔倒了。
为了治疗伤口，我使用了刚学会的“治疗”。"
110,"TEXT_AKTKMA111_04367_ALPHINAUD_000_127","治好了她的伤口，看到她高兴的样子，我很欣慰。
后来我渐渐地优先学习治疗魔法，
契机说不定就是这件事呢。"
111,"TEXT_AKTKMA111_04367_ALISAIE_000_130","我以前常和爷爷一起来这里！
夏天还会在这边玩水……"
112,"TEXT_AKTKMA111_04367_ALISAIE_000_131","这么说来，从那个时候阿尔菲诺就不喜欢玩水呢。
他总是会找个理由跑开。"
113,"TEXT_AKTKMA111_04367_ALISAIE_000_132","于是我们拉开了差距。
我能像海鹦一样游泳，他却是个旱鸭子！"
114,"TEXT_AKTKMA111_04367_ALISAIE_000_135","你决定不去了吗！
呃，不——是啦，其实你去不去我都无所谓的！
不过我姑且会在哲学家广场稍微等你一会！"
115,"TEXT_AKTKMA111_04367_ALISAIE_000_140","你果然还是要去我家吗？不论如何都要吗？
呜呜，毕竟已经跟母亲说好了，没办法啊。"
116,"TEXT_AKTKMA111_04367_AMELIANCE_000_150","咦？你们三人怎么没有一起过来呀。
机会难得，我希望你们能够一起过来！"
117,"TEXT_AKTKMA111_04367_SYSTEM_000_151","在执行该任务时，需要与阿尔菲诺和阿莉塞保持同行状态。
此外，阿尔菲诺和阿莉塞应位于玩家附近。"
118,"TEXT_AKTKMA111_04367_AMELIANCE_000_160","啊，你们都到了啊！
快进去吧！"
119,"TEXT_AKTKMA111_04367_ALISAIE_000_170","这下又要暂时跟这个家说再见了呢……"
120,"TEXT_AKTKMA111_04367_ALPHINAUD_000_180","谢谢你陪着我们回家。
刚才母亲都跟你说了什么……
我就不多问了。"
121,"TEXT_AKTKMA111_04367_ALPHINAUD_000_181","虽然只是短暂的时光，但如今对我们来说已经足够了。
就像这身衣服还有贤具一样，母亲的思念随时陪伴在我们身旁。"
122,"TEXT_AKTKMA111_04367_ALPHINAUD_000_182","好了，我们返回巴尔德西昂分馆，
继续做该做的事情吧！"
123,"TEXT_AKTKMA111_04367_KRILE_000_190","欢迎回来！
收获如何……他们俩这身打扮已经说明一切了呢！"
124,"TEXT_AKTKMA111_04367_KRILE_000_191","为了让他们以后能堂堂正正地回家，
我也要更加努力啊。"
125,"TEXT_AKTKMA111_04367_KRILE_000_192","哲学家议会正在坚定地执行着某种使命……
从海德林那里拿到的映照人心的花……
我们已经将连接着真相的线索握在了手中。"
126,"TEXT_AKTKMA111_04367_KRILE_000_193","桑克瑞德他们应该也会从萨维奈岛带回新的真相。
然后我们所有人一起商量今后的行动吧！"
127,"TEXT_AKTKMA111_04367_KRILE_000_194","桑克瑞德他们应该也会从萨维奈岛带回新的真相。
先等他们的报告，然后一起来商量今后的行动吧！"
128,"TEXT_AKTKMA111_04367_AMELIANCE_000_155",""
