key,0,1
#,,
int32,str,str
0,"TEXT_FESGSC401_03963_SEQ_00","※本任务是特定期间内的任务。

乌尔达哈的纳纳佛恩正在寻找能够帮忙的人。"
1,"TEXT_FESGSC401_03963_SEQ_01","※本任务只有在季节活动开放期间才能接受和进行。
　季节活动结束后无法进行，敬请注意。
　详情请参见官方网站。

和纳纳佛恩进行了交谈。由于限时企划反响热烈导致人手不足，于是开始募集临时的接引向导。冒险者决定应募临时的接引向导帮忙。在金碟游乐场的入口广场的<Sheet(EObj,2011233,0)/>等待。"
2,"TEXT_FESGSC401_03963_SEQ_02","在<Sheet(EObj,2011233,0)/>等待。副主管罗兰德和金碟游乐场向导出现，委托前来帮忙的人们去工作人员那里听取各种游乐项目的说明。和各个广场的工作人员对话，了解各种游乐项目。"
3,"TEXT_FESGSC401_03963_SEQ_03","和各个广场的工作人员进行了交谈。与演出广场的金碟游乐场向导对话，开始接待客人。"
4,"TEXT_FESGSC401_03963_SEQ_04","和金碟游乐场向导对话之后，接待了客人。再次和入口广场的金碟游乐场向导对话，领取报酬。"
5,"TEXT_FESGSC401_03963_SEQ_05","和金碟游乐场向导对话，领取了报酬。时间充裕的话，可以再次前往金碟游乐场帮忙。"
6,"TEXT_FESGSC401_03963_SEQ_06",""
7,"TEXT_FESGSC401_03963_SEQ_07",""
8,"TEXT_FESGSC401_03963_SEQ_08",""
9,"TEXT_FESGSC401_03963_SEQ_09",""
10,"TEXT_FESGSC401_03963_SEQ_10",""
11,"TEXT_FESGSC401_03963_SEQ_11",""
12,"TEXT_FESGSC401_03963_SEQ_12",""
13,"TEXT_FESGSC401_03963_SEQ_13",""
14,"TEXT_FESGSC401_03963_SEQ_14",""
15,"TEXT_FESGSC401_03963_SEQ_15",""
16,"TEXT_FESGSC401_03963_SEQ_16",""
17,"TEXT_FESGSC401_03963_SEQ_17",""
18,"TEXT_FESGSC401_03963_SEQ_18",""
19,"TEXT_FESGSC401_03963_SEQ_19",""
20,"TEXT_FESGSC401_03963_SEQ_20",""
21,"TEXT_FESGSC401_03963_SEQ_21",""
22,"TEXT_FESGSC401_03963_SEQ_22",""
23,"TEXT_FESGSC401_03963_SEQ_23",""
24,"TEXT_FESGSC401_03963_TODO_00","在金碟游乐场的<Sheet(EObj,2011233,0)/>等待"
25,"TEXT_FESGSC401_03963_TODO_01","和宠物广场的工作人员对话"
26,"TEXT_FESGSC401_03963_TODO_02","和幻卡广场的工作人员对话"
27,"TEXT_FESGSC401_03963_TODO_03","和圆形广场的工作人员对话"
28,"TEXT_FESGSC401_03963_TODO_04","和演出广场的工作人员对话"
29,"TEXT_FESGSC401_03963_TODO_05","和奇妙广场的工作人员对话"
30,"TEXT_FESGSC401_03963_TODO_06","和金碟游乐场向导对话"
31,"TEXT_FESGSC401_03963_TODO_07","再次和金碟游乐场向导对话"
32,"TEXT_FESGSC401_03963_TODO_08",""
33,"TEXT_FESGSC401_03963_TODO_09",""
34,"TEXT_FESGSC401_03963_TODO_10",""
35,"TEXT_FESGSC401_03963_TODO_11",""
36,"TEXT_FESGSC401_03963_TODO_12",""
37,"TEXT_FESGSC401_03963_TODO_13",""
38,"TEXT_FESGSC401_03963_TODO_14",""
39,"TEXT_FESGSC401_03963_TODO_15",""
40,"TEXT_FESGSC401_03963_TODO_16",""
41,"TEXT_FESGSC401_03963_TODO_17",""
42,"TEXT_FESGSC401_03963_TODO_18",""
43,"TEXT_FESGSC401_03963_TODO_19",""
44,"TEXT_FESGSC401_03963_TODO_20",""
45,"TEXT_FESGSC401_03963_TODO_21",""
46,"TEXT_FESGSC401_03963_TODO_22",""
47,"TEXT_FESGSC401_03963_TODO_23",""
48,"TEXT_FESGSC401_03963_NANAPHON_000_000","那边路过的冒险者！
能请你稍微听一听我的请求吗？！"
49,"TEXT_FESGSC401_03963_NANAPHON_000_001","啊，你是……！
你还记得我吗？！
我是仙人刺先生的聘用考试时受过你帮助的纳纳佛恩！"
50,"TEXT_FESGSC401_03963_NANAPHON_100_001","怎么样？
想起来了吗？！"
51,"TEXT_FESGSC401_03963_NANAPHON_000_002","我叫纳纳佛恩……
是金碟游乐场的工作人员。"
52,"TEXT_FESGSC401_03963_NANAPHON_000_003","现在金碟游乐场正在举行
1.5倍金碟币限时活动……"
53,"TEXT_FESGSC401_03963_NANAPHON_000_004","但是，因为实际反响比想象的还要热烈，
所以现在陷入了人手不足的困境！"
54,"TEXT_FESGSC401_03963_NANAPHON_000_005","于是，我们打算募集临时的接引向导，
根据业绩来支付报酬，可以请你帮帮忙吗？"
55,"TEXT_FESGSC401_03963_NANAPHON_000_006","谢谢你！
那么，我先去跟负责人说一声，
能请你在金碟游乐场的入口广场稍等片刻吗？"
56,"TEXT_FESGSC401_03963_NANAPHON_000_007","要是你没去过金碟游乐场的话，
就和那边的挥金如土的年轻人谈谈吧。
他看上去很大方，应该会给你去金碟游乐场的票。"
57,"TEXT_FESGSC401_03963_SYSTEM_000_008","若要领取或继续推进本任务，需要在乌尔达哈现世回廊领取
15级才能领取的任务“前往游乐场”。"
58,"TEXT_FESGSC401_03963_NANAPHON_000_009","我现在要去跟负责人说明一下情况，
能请你在金碟游乐场的入口广场稍等片刻吗？"
59,"TEXT_FESGSC401_03963_NANAPHON_000_010","要是你没去过金碟游乐场的话，
就和那边的挥金如土的年轻人谈谈吧。
他看上去很大方，应该会给你去金碟游乐场的票。"
60,"TEXT_FESGSC401_03963_SYSTEM_000_011","若要领取或继续推进本任务，需要在乌尔达哈现世回廊领取
15级才能领取的任务“前往游乐场”。"
61,"TEXT_FESGSC401_03963_ROLAND_000_020","(-？？？？-)哎哟！
纳纳佛恩说的人原来是<Highlight>ObjectParameter(1)</Highlight>呀！"
62,"TEXT_FESGSC401_03963_ROLAND_000_021","(-？？？？-)哎呀哎呀！
真是不好意思，让你久等了吧？"
63,"TEXT_FESGSC401_03963_ROLAND_000_022","我是负责管理这里的罗兰德，
感谢你这次的帮助。"
64,"TEXT_FESGSC401_03963_ROLAND_000_023","我想你已经听说了，
这次要委托你担任临时的接引向导。"
65,"TEXT_FESGSC401_03963_ROLAND_000_024","在这个游乐场中，有许多游乐项目。
因此，判断推荐哪个项目能够让客人获得满意的体验
尤为重要。"
66,"TEXT_FESGSC401_03963_ROLAND_000_025","首先请你在游乐场内的5个广场巡回一圈，
从负责各个游乐项目的工作人员那里听取项目的说明吧。"
67,"TEXT_FESGSC401_03963_ROLAND_000_026","如果你觉得已经掌握了各个项目的内容，
就和金碟游乐场向导说一声吧，
他会带你进行实践的！"
68,"TEXT_FESGSC401_03963_STAFFF_000_027","请你先在游乐场内的5个广场巡回一圈，
从负责各个游乐项目的工作人员那里听取项目的说明，
完成之后，请跟我说一声……"
69,"TEXT_FESGSC401_03963_STAFFA_000_030","在宠物广场中，
可以驱使宠物进行攻防战……
请尽情享受“萌宠之王”大赛的乐趣吧。"
70,"TEXT_FESGSC401_03963_STAFFA_000_031","不仅是那些觉得宠物们可爱的客人们，
也推荐对指挥能力有自信的客人们参加哦！"
71,"TEXT_FESGSC401_03963_STAFFB_000_032","幻卡广场为大家提供的是
“九宫幻卡”卡牌对局……"
72,"TEXT_FESGSC401_03963_STAFFB_000_033","由于需要猜测对手的意图来决定如何落卡，
所以非常适合喜欢头脑战的客人哦！"
73,"TEXT_FESGSC401_03963_STAFFC_000_034","我已经从罗兰德副主管那里得知了情况。
你想了解哪个游乐项目呢？"
74,"TEXT_FESGSC401_03963_Q1_000_000","听取哪个游乐项目的说明？"
75,"TEXT_FESGSC401_03963_A1_000_001","关于“小雏鸟的营救者”"
76,"TEXT_FESGSC401_03963_A1_000_002","关于“虚景跳跳乐大挑战”"
77,"TEXT_FESGSC401_03963_A1_000_003","取消"
78,"TEXT_FESGSC401_03963_STAFFC_000_035","将登上顶端无法下来的小雏鸟
从哥布林族的炸弹攻势中救出！
这便是“小雏鸟的营救者”。"
79,"TEXT_FESGSC401_03963_STAFFC_000_036","是适合想要享受爆炸带来的刺激感
以及充满勇气的客人们的游乐项目哦。
不过对于只想疼爱宠物的客人来说，可能会有些不太合适。"
80,"TEXT_FESGSC401_03963_STAFFC_000_037","跑起来，跳起来，向着终点前进！
参加专门开设的跳跃比赛，
争取在限制时间内抵达终点赢得金碟币奖励。"
81,"TEXT_FESGSC401_03963_STAFFC_000_038","由于需要在高处的踏板之间进行跳跃，
所以推荐体能强悍、意志坚强的客人们挑战。
不过，对于恐高的客人们来说就比较艰难了。"
82,"TEXT_FESGSC401_03963_STAFFD_000_039","你就是新来的接引向导吧？
你想要了解哪个游乐项目呢？"
83,"TEXT_FESGSC401_03963_Q2_000_000","听取哪个游乐项目的说明？"
84,"TEXT_FESGSC401_03963_A2_000_001","关于“喷风中的幸存者”"
85,"TEXT_FESGSC401_03963_A2_000_002","关于“必中一闪快刀斩魔”"
86,"TEXT_FESGSC401_03963_A2_000_003","关于“重击吉尔伽美什”"
87,"TEXT_FESGSC401_03963_A2_000_004","关于“莫古抓球机”"
88,"TEXT_FESGSC401_03963_A2_000_005","取消"
89,"TEXT_FESGSC401_03963_STAFFD_000_040","漂亮地避开在咒术师行会的实验中被召唤出的妖异——
“提丰”老师的“鼻息”！
这便是“喷风中的幸存者”的游戏内容。"
90,"TEXT_FESGSC401_03963_STAFFD_000_041","这是一个十分考验运气的项目，
所以任何人都可以轻松地参加。
对于想要体验心跳感的客人们来说十分合适哦！"
91,"TEXT_FESGSC401_03963_STAFFD_000_042","这个机遇任务是要登上舞台躲避保镖老师的攻击。
在台上能站得越久，得到的奖励就越多。
加上还有拾取金币堆的运气要素，一定能让您玩得开心。"
92,"TEXT_FESGSC401_03963_STAFFD_000_043","在瞬间看穿剑势走向，
推荐对动态视力或者反射神经有自信的客人们参加哦！"
93,"TEXT_FESGSC401_03963_STAFFD_000_044","随着呼吸的节奏，打出强力一击！
就是比赛拳力的“重击吉尔伽美什”了。"
94,"TEXT_FESGSC401_03963_STAFFD_000_045","想要打出好成绩，不仅考验腕力，
掌握正确的出拳技巧也是十分重要的。"
95,"TEXT_FESGSC401_03963_STAFFD_000_046","“莫古抓球机”是操作莫古力，
成功抓球即可获得金碟币的小游戏。"
96,"TEXT_FESGSC401_03963_STAFFD_000_047","是擅长操作机械的客人们经常游玩的项目哦。
另外还有传言说……
也有一些客人是为了向附近的兔女郎搭话才来游玩的。"
97,"TEXT_FESGSC401_03963_STAFFE_000_056","你就是临时的接引向导吧！
请随意提问吧！"
98,"TEXT_FESGSC401_03963_Q3_000_000","听取哪个游乐项目的说明？"
99,"TEXT_FESGSC401_03963_A3_000_001","关于“强袭水晶塔”"
100,"TEXT_FESGSC401_03963_A3_000_002","关于“多玛方城战”"
101,"TEXT_FESGSC401_03963_A3_000_003","取消"
102,"TEXT_FESGSC401_03963_STAFFE_000_048","选择合适的时机落下锤子，获取点数，
就是“强袭水晶塔”这个项目了。"
103,"TEXT_FESGSC401_03963_STAFFE_000_049","擅长使用锤子或是能够坚持使出浑身一击的客人
会非常适合这个项目。"
104,"TEXT_FESGSC401_03963_STAFFE_000_050","“多玛方城战”就是4位玩家利用多玛方城牌对战，
相互间斗智斗勇的激烈游戏！"
105,"TEXT_FESGSC401_03963_STAFFE_000_051","虽然需要记住许多规则，
但是可以在对战中猜测对方的战略，享受斗智的乐趣。
也推荐对东方文化感兴趣的客人们参加哦！"
106,"TEXT_FESGSC401_03963_STAFFF_000_060","你回来了呀！
已经准备好接待客人了吗？"
107,"TEXT_FESGSC401_03963_Q4_000_000","准备好了吗？"
108,"TEXT_FESGSC401_03963_STAFFF_000_061","那么马上去实践一下吧！
来，这边请！"
109,"TEXT_FESGSC401_03963_HAMON_000_062","(-？？？？-)哈哈哈！
你在做什么呢，<Highlight>ObjectParameter(1)</Highlight>？"
110,"TEXT_FESGSC401_03963_HAMON_000_063","哦，原来是临时的接引向导呀？
那你能帮帮我吗？"
111,"TEXT_FESGSC401_03963_HAMON_000_064","(-？？？？-)哈哈哈！
那边那个人，能帮帮我吗？"
112,"TEXT_FESGSC401_03963_HAMON_000_065","我正在烦恼要玩哪个项目……
年轻的时候我曾用格斗术赢过各种豪杰，十分受欢迎……
有没有那种很受火辣美人欢迎的项目呢？"
113,"TEXT_FESGSC401_03963_Q5_000_000","要推荐哪个项目？"
114,"TEXT_FESGSC401_03963_A5_000_001","“多玛方城战”怎么样？"
115,"TEXT_FESGSC401_03963_A5_000_002","“重击吉尔伽美什”怎么样？"
116,"TEXT_FESGSC401_03963_A5_000_003","“九宫幻卡”怎么样？"
117,"TEXT_FESGSC401_03963_HAMON_000_066","呼呼呼！那我马上就去！
用这双拳头打出一个高分吧！"
118,"TEXT_FESGSC401_03963_SYSTEM_100_066","客人似乎对这个项目很感兴趣。
看来是介绍了合适的游乐项目！"
119,"TEXT_FESGSC401_03963_HAMON_000_067","……只要玩这个，我就能受欢迎吗？
算了，总之先去试试看吧。"
120,"TEXT_FESGSC401_03963_SYSTEM_100_067","客人似乎对这个项目没什么兴趣。
看来是介绍了错误的游乐项目……"
121,"TEXT_FESGSC401_03963_MYLLA_000_068","(-？？？？-)这不是<Highlight>ObjectParameter(1)</Highlight>吗！
你为什么会在金碟游乐场啊？"
122,"TEXT_FESGSC401_03963_MYLLA_000_069","原来如此，接引向导啊……
那能不能请你为我推荐一下呢。"
123,"TEXT_FESGSC401_03963_MYLLA_000_070","(-？？？？-)打扰了。
我有事想问一下。"
124,"TEXT_FESGSC401_03963_MYLLA_000_071","我想用休息时间，利用剑术来赚点钱。
有没有和锻炼有关的游乐项目啊？"
125,"TEXT_FESGSC401_03963_Q6_000_000","要推荐哪个项目？"
126,"TEXT_FESGSC401_03963_A6_000_001","“喷风中的幸存者”怎么样？"
127,"TEXT_FESGSC401_03963_A6_000_002","“强袭水晶塔”怎么样？"
128,"TEXT_FESGSC401_03963_A6_000_003","“必中一闪快刀斩魔”怎么样？"
129,"TEXT_FESGSC401_03963_MYLLA_000_072","哦，看穿剑势走向来躲避吗……
听上去很有趣嘛，帮大忙了！"
130,"TEXT_FESGSC401_03963_SYSTEM_100_072","客人似乎对这个项目很感兴趣。
看来是介绍了合适的游乐项目！"
131,"TEXT_FESGSC401_03963_MYLLA_000_073","感觉无法想象如何活用在剑术上呢……
有时间我会去看看的。"
132,"TEXT_FESGSC401_03963_SYSTEM_100_073","客人似乎对这个项目没什么兴趣。
看来是介绍了错误的游乐项目……"
133,"TEXT_FESGSC401_03963_ADALBERTA_000_074","(-？？？？-)没想到会在这里见到你，
今天休息吗？"
134,"TEXT_FESGSC401_03963_ADALBERTA_000_075","居然是在工作啊。
那能不能请你为我推荐一下游乐项目呢。"
135,"TEXT_FESGSC401_03963_ADALBERTA_000_076","(-？？？？-)那边的人！
我可以问你一些事吗？"
136,"TEXT_FESGSC401_03963_ADALBERTA_000_077","有没有能让我这个采矿工畅玩的游乐项目啊？
我去很多地方挖掘过矿物，
所以对自己的腰腿很有自信……"
137,"TEXT_FESGSC401_03963_Q7_000_000","要推荐哪个项目？"
138,"TEXT_FESGSC401_03963_A7_000_001","“莫古抓球机”怎么样？"
139,"TEXT_FESGSC401_03963_A7_000_002","“虚景跳跳乐大挑战”怎么样？"
140,"TEXT_FESGSC401_03963_A7_000_003","“萌宠之王”怎么样？"
141,"TEXT_FESGSC401_03963_ADALBERTA_000_078","哦哦，听上去很有趣呢。
我很习惯在狭窄的踏板上行走呢，
我这就去试试能不能在那上面用到这些经验，谢谢你！"
142,"TEXT_FESGSC401_03963_SYSTEM_100_078","客人似乎对这个项目很感兴趣。
看来是介绍了合适的游乐项目！"
143,"TEXT_FESGSC401_03963_ADALBERTA_000_079","虽然让人无法联想到工作这一点很好，
不过到底会有多有趣呢……？"
144,"TEXT_FESGSC401_03963_SYSTEM_100_079","客人似乎对这个项目没什么兴趣。
看来是介绍了错误的游乐项目……"
145,"TEXT_FESGSC401_03963_STAFFF_000_080","感谢你帮忙接待客人！
多亏有你在，其他业务也能够完成了。
我们也已经从各位客人那里收集到了反馈。"
146,"TEXT_FESGSC401_03963_STAFFF_000_081","各位客人都非常开心！
这次的接待任务十分成功，
今后也请务必作为接引向导来为客人们推荐项目啊!"
147,"TEXT_FESGSC401_03963_STAFFF_000_082","接受了推荐的客人中，
似乎不少人都充分地享受了项目的乐趣。
是非常了不起的成果哦！"
148,"TEXT_FESGSC401_03963_STAFFF_000_083","接受了推荐的客人们，
似乎完全没有享受到项目的乐趣。
或许应该多考虑一下对方的爱好和特技比较好……"
149,"TEXT_FESGSC401_03963_ROLAND_000_084","辛苦了。
我从旁边观察了你们工作时的样子。
大家认真地进行接待工作的样子给我留下了很深的印象。"
150,"TEXT_FESGSC401_03963_ROLAND_000_085","……<Highlight>ObjectParameter(1)</Highlight>，你觉得怎么样？
要不要留下来做我们的正式员工，
在金碟游乐场工作呢？"
151,"TEXT_FESGSC401_03963_STAFFF_000_086","哎呀，副主管！
我只是拜托<If(PlayerParameter(4))>她<Else/>他</If>暂时来帮一下忙而已！"
152,"TEXT_FESGSC401_03963_ROLAND_000_087","哈哈！开玩笑的！
一直这么麻烦<Highlight>ObjectParameter(1)</Highlight>可不行。"
153,"TEXT_FESGSC401_03963_ROLAND_000_088","最后……<Highlight>ObjectParameter(1)</Highlight>，
请容我再次对你这次的帮助表示感谢！"
154,"TEXT_FESGSC401_03963_STAFFF_000_090","虽然已经说了很多次了，不过请让我也对你道个谢吧。
真的非常感谢你！"
155,"TEXT_FESGSC401_03963_STAFFF_000_091","不过，实际上罗兰德副主管说的也没错，
目前游乐场的人手依然不足……
如果有时间能再帮帮忙的话就再好不过了。"
156,"TEXT_FESGSC401_03963_STAFFF_000_092","来，虽然有些迟了，不过还请收下这个。
这是为了感谢你的帮助，由我们准备的一点心意。"
157,"TEXT_FESGSC401_03963_SYSTEM_000_093","学会了情感动作“疑问”！"
158,"TEXT_FESGSC401_03963_SYSTEM_000_094","另外，和金碟游乐场向导旁边的
化妆舞会的接待员对话，
可以参加废弃宅邸的化妆舞会。"
